review_id,product_id,customer_id,rating,review_text,review_date
869,385,396,1,Wonder best lose about pull. Box true local successful describe her against.,2024-10-29
870,122,450,5,Station charge produce war interest.,2024-06-07
871,368,937,1,Sea industry hair order environmental add recent. Can page brother during.,2024-01-09
872,313,393,2,Business likely unit position positive. Per stand town.,2024-10-21
873,172,878,3,Rich training tend community. Ever relationship though this. Play threat marriage off most.,2024-07-08
874,323,621,3,Cause drug serious fly senior member. Final threat cell both cultural.,2024-07-28
875,25,783,4,Institution after deal whatever somebody none would. Son matter also election degree personal.,2024-08-24
876,202,436,1,Catch ok interest reflect. Might air meet each. Pass hospital ahead.,2024-11-26
877,293,230,5,Customer firm marriage discussion see natural. Full perform team least dream goal protect.,2024-08-18
878,234,356,3,Wonder southern yet pressure pressure young stand.,2024-10-07
879,8,247,3,Quickly school world culture rest. Hotel seem significant.,2024-11-29
880,398,353,3,Rule people civil top material. Professional compare window above.,2024-09-22
881,102,871,2,Economy finally half politics image lot. Ready heavy our huge water ground firm. Lose thing science billion.,2024-10-23
882,131,590,1,House wear difficult which. Activity recognize understand fly film important front. Evening become everything TV recognize Mrs.,2024-05-24
883,260,919,5,Again figure different present color song. Ask represent be across board building agent.,2024-11-29
884,418,239,2,Run protect big figure fish. Possible month alone.,2024-11-06
885,299,989,5,Ground often site human factor evening. Indicate stuff city management newspaper real.,2024-11-25
886,202,420,5,Task ground material chance have building beat. Against cause million. Job learn management scientist once answer often letter.,2024-11-22
887,376,127,5,Game strategy professional kind talk rich billion. Country him high they before clearly group friend. Word start win next.,2024-11-06
888,77,744,4,Movie point cut probably. Future sign worry law capital great better. Sister sit minute here.,2024-05-15
889,108,397,3,Window take occur edge. Window network federal play know employee generation. Defense be continue design impact statement really positive.,2023-11-25
890,128,739,4,Heart human ready. However service entire. Accept future remain difference firm.,2024-11-11
891,15,315,5,Follow majority analysis. Meet knowledge as top discussion role computer. Remain gun hundred than group education perhaps.,2023-09-20
892,48,536,1,Talk pressure article fine likely market just effect. Institution institution executive everyone.,2024-08-26
893,294,156,2,Budget upon from billion president add. Activity exist data say direction gas your. Ability indicate style almost. Physical agency tough rather serve hand affect.,2024-10-21
894,266,485,2,Exactly growth look series child. Writer Mr early whatever. Whether drop visit area senior tend music man.,2024-09-25
895,263,117,3,Law father these community individual. Up wide interest. Entire raise message available miss play.,2024-11-08
896,192,460,5,Him tell family. Lead candidate property all claim night give.,2024-05-10
897,489,570,5,Somebody chance against country Mrs suffer. Do company good general. Hot then artist fund.,2024-03-11
898,253,570,1,Charge our set thing whatever blood happen. Know stock back. Will stuff prove at job guess young.,2024-10-04
899,76,560,3,Everyone reason save site follow federal remain. Important ability wide stay religious turn sister. Various deep admit quickly board others.,2024-08-09
900,228,671,4,Still customer society field truth lose song. Growth build glass speak.,2024-11-24
901,182,165,4,Buy consider one. Particularly act board. Her thank old always.,2024-11-04
902,451,122,1,Old large do wear night news figure technology. Already quality laugh little that assume mouth stage.,2024-11-29
903,149,954,5,Answer employee area head watch share mean. Professor commercial edge hundred. Expect stop debate piece too likely Congress food. Order rock determine finally popular bit fly.,2024-11-18
904,115,415,4,Dream bed responsibility already such. Near himself wind method class.,2024-10-15
905,422,727,4,East information ask them. Improve executive sport hold only. Myself easy fund wide while understand various.,2024-08-13
906,178,360,1,Relationship hope amount method cut. Current expect better understand network money.,2024-07-25
907,208,463,1,Beat which say wrong hotel employee how. Appear culture idea. Sister federal almost law style.,2024-09-03
908,335,54,5,Fish each sea. Course beyond doctor end.,2024-06-12
909,339,387,1,Record of skin particularly around threat their. Land test three medical since food. Out question company open put brother team its. Successful something visit dinner most dog make story.,2024-11-27
910,321,35,1,Ever skill return budget prepare appear. In front down wonder this then series.,2024-09-16
911,491,322,3,Simple attention suddenly recently take against less. After feeling prevent after media house course. Public so heart career wife.,2024-05-01
912,91,513,2,Leader cold nor study scene. Scientist season five director avoid medical effort. Article at only gun force billion.,2024-07-30
913,28,973,4,Tax agent court concern sport. Suggest identify cut reason room she.,2024-03-24
914,40,633,3,History type consumer partner race you. Gas already people trouble. Husband thank above operation dark nice.,2024-07-22
915,376,561,3,Course police decision off book. Finally can behavior gun old benefit guess.,2024-09-04
916,125,900,1,Voice hit push program. President game still than parent worker arrive. Peace him nation end avoid.,2024-11-18
917,225,507,3,Billion attack quite sea spend foreign much. Everything contain technology bring civil. Technology rule Mrs security collection behind glass. Analysis produce TV executive eat concern child.,2024-09-18
918,155,341,5,Court treatment everybody remain science. Community writer method prepare. Stage form throughout stuff.,2024-10-08
919,113,630,3,Report room apply music school if yourself civil. I each between walk less. Hear fish writer eye defense interest threat.,2024-08-26
920,300,780,5,General throw accept past. Believe everybody five crime major several.,2024-10-08
921,287,110,2,Wife responsibility bed specific across how father. Industry your company population onto of help chance. Shake hold myself born keep.,2024-04-28
922,419,295,4,Wall understand cut most maybe already. Relationship political unit leave give culture site. Structure realize fine they black.,2024-08-28
923,458,698,4,Accept anything billion break class entire dog. Picture great media treatment.,2024-10-03
924,452,405,5,Tend ten send he. Analysis music stage red.,2024-10-22
925,65,990,1,Unit hold soon over relate difficult. Strategy represent term agency rich feeling. Can politics woman necessary action movie.,2024-11-15
926,456,719,2,School energy rich unit edge property forward. Father usually enough paper.,2024-09-25
927,330,577,4,Human director building ahead large notice. Realize for newspaper ago. Give unit girl serious. Each television father play yes stay.,2024-11-27
928,298,36,2,Worry forward ago fight hold sing threat. Popular message trouble race as wait. During carry feel result woman five.,2024-11-05
929,86,791,3,Bed boy total employee mention practice. Himself inside site morning. Tree agency into including.,2024-11-29
930,189,106,5,Number scene chair yourself ask left evening. With deal piece challenge important animal. Kitchen hour southern perform without including Mr.,2024-09-22
931,428,157,2,Yourself the bring candidate always material find. Week operation discussion information. Amount property yourself.,2024-11-15
932,407,490,3,Again firm news tax city model tend contain. Type help call apply marriage structure wind.,2024-09-17
933,278,185,3,Seek throw little meet behavior story. Hold open range just take drug prevent he.,2024-07-26
934,116,517,1,Theory environment use second a guess seek Congress. Beat own by challenge site stop. Fund its city relationship trade she.,2024-11-21
935,105,828,3,Concern television bit you safe type person. Rock I two enjoy money majority radio.,2024-05-12
936,116,186,3,Modern thousand reality really business paper eye. Person line little color. Herself stuff southern year case magazine social.,2024-07-14
937,453,562,2,Town enjoy treatment parent measure assume. Writer organization organization generation citizen. Office success black positive guy rather another.,2024-07-31
938,116,186,5,Enjoy decade discuss me and material. Billion expect hair bar teach international letter foreign. Her trial listen strategy since pretty.,2024-11-27
939,102,434,4,Party record military. Whatever east young think.,2024-11-10
940,462,406,1,Unit employee professor hair three. Father tell much.,2024-09-26
941,182,177,5,Act series already account. Want prevent other film series discussion everybody. Bar result floor member list would. Factor all pick network painting.,2024-10-31
942,483,96,1,Report author woman listen kind like director. Star she beautiful at media.,2024-11-06
943,180,230,4,Issue analysis home cold. Listen kid information street. Matter similar garden market fear collection. Almost article also act already more.,2024-10-02
944,57,580,1,Ready continue well. Past account himself movie. Third seek parent old someone clear change.,2024-01-10
945,312,809,4,Region glass final along personal. Region option family. Popular suggest center address.,2024-08-01
946,184,21,2,Poor force candidate line including energy race eat. Democratic half up type meeting teacher dark.,2024-08-29
947,186,360,2,Six law speech fill.,2024-10-16
948,407,301,4,Charge expert for nor fill pretty. Wind especially position international send occur development white. Management focus network color.,2023-12-15
949,340,958,5,Suffer ask should protect wait foreign ahead. Play friend lay activity. Team magazine couple.,2024-11-25
950,103,186,5,One bed PM money inside back. Seven miss decision fund. Along information best beat particular seat rich.,2024-08-09
951,444,524,5,Really foot case guess last party. Agreement remain group stock.,2024-08-23
952,458,698,4,About yeah room old nice. Pressure million stage population.,2024-10-21
953,88,373,5,Country activity dog recent long long. Box my may cover west operation. Few only bad almost soon. Our scene explain despite far.,2024-06-11
954,2,518,3,Fund five guess mouth television choose positive.,2024-11-03
955,313,658,1,Building almost maybe really fly tree write.,2024-11-06
956,467,183,5,Certain market change city good year upon. Modern analysis offer several animal green.,2024-11-10
957,169,995,5,Join spend ok person data. May sea describe group magazine difference skin president.,2024-08-12
958,173,592,2,See me thus someone nation black. Successful main month learn time. Voice moment happen realize feeling benefit.,2024-11-12
959,61,987,2,Leg avoid money keep be. President agency cup.,2024-09-03
960,194,636,1,Process tax little wife less common. Develop evidence fill subject manage single.,2024-09-24
961,1,548,1,Tree worry response among challenge measure. Population run contain mean fast identify.,2024-11-01
962,276,177,3,Style light base now. Method manager yourself box purpose. Early ability parent institution much measure short.,2024-10-06
963,293,575,1,One particular beautiful cover upon candidate impact. Everything religious air within. Expect from member guy number task sister.,2024-11-28
964,491,427,1,Western early within face that. Whole former clear. Spring story good nice.,2024-11-01
965,134,300,4,Arm talk later do actually conference. Treat nothing gas trouble reveal position.,2024-01-27
966,63,307,3,He hand eight mission name carry represent. Later area attack design seek because owner.,2024-08-26
967,354,186,5,Choice describe race research store. Woman quality face believe teacher.,2024-10-19
968,292,788,1,Inside rather able teacher late move investment. Up idea eye prove seven tree also.,2024-10-15
969,134,903,5,Voice have of choose doctor. Because natural on first become.,2024-11-13
970,64,544,5,Girl camera you. Pressure help cell sing. Whom wide through exactly I.,2024-11-24
971,204,247,1,Respond garden guy finish as environment. Campaign everybody cell five across.,2024-11-26
972,406,324,3,Bag fill number enter. Team to rather institution what he. Successful game pressure work set.,2024-11-29
973,190,141,3,Instead color lose science. Simple agency follow order reality.,2023-11-15
974,386,805,2,Protect culture debate general along mind painting. Ten be range out structure win. Clear million war.,2024-11-28
975,134,80,5,Half reflect new nearly summer. Government suggest let to price citizen enter. News clearly dog remain ground building.,2024-08-17
976,235,665,4,Since theory each. Identify just any spend wait.,2024-11-19
977,80,425,4,More common machine. Summer receive issue American. Become itself trip indeed.,2024-04-23
978,381,462,2,Ago trade meeting name. Lead parent thing technology rate there.,2024-11-29
979,488,174,5,Thing economic bit experience. History wonder everybody enough beautiful forward. Agree federal collection off.,2024-09-15
980,72,237,2,Professional school event purpose better should attorney. Talk there according nor authority able improve.,2024-10-31
981,332,766,4,Difficult reduce professor peace majority thing local. Tell investment within arrive.,2024-11-10
982,162,588,2,Fly garden where growth. Partner list move section all study series. Manager fly girl staff blood.,2024-04-21
983,393,819,5,Cut many firm black network by purpose. Market seek dream them. Good reduce huge score situation growth. Sport community raise material.,2024-11-01
984,500,921,1,Total fill lot what argue. Common stage action father his research.,2024-10-26
985,395,34,4,Treat could machine necessary enter out wrong. Tonight whatever number ball feeling good. Condition cultural chance play yourself.,2024-11-11
986,395,438,3,Major campaign quite measure. Growth own fly former.,2024-06-18
987,160,225,2,Sound want learn continue. Boy medical only participant environment. Budget them value face only.,2024-11-15
988,231,629,2,After man task religious would without.,2024-11-26
989,24,402,1,Your nice want democratic until all official.,2024-07-11
990,135,571,2,Minute check throw style suffer. Agency central week quality citizen must good.,2024-11-13
991,399,148,4,Make rich well forget soldier dinner know. Pretty amount hotel speech money exactly. Rich movie civil once pressure why in available.,2024-11-25
992,50,560,5,Live way debate anything. Agreement happy final bank network. Nature wait magazine fill chance standard.,2024-10-11
993,219,758,3,Say trip raise you best national store. Provide adult see trade beautiful. Dream PM choice yourself move decade improve.,2024-11-06
994,449,403,2,Center light eye do. Win teacher order station. Thank minute born believe.,2024-06-21
995,193,308,5,Write news rather save hard skill. Billion myself think wrong.,2024-07-16
996,151,333,5,Notice give popular president. Close structure tonight. Pass another daughter politics kitchen step.,2024-09-17
997,56,465,3,Serve its concern again attention lead example. Nation decade only raise. General sort magazine sell fund raise.,2024-11-22
998,92,102,4,Success ever price. Against or enjoy pull summer.,2024-11-19
999,177,804,3,Computer between natural degree statement good level. Listen tell as. Adult establish low run score cause common these.,2024-08-07
1000,259,284,2,Specific Mrs act ago black some avoid. Production when order important camera. Movie information each you draw move.,2024-06-04
1001,88,689,1,Clear group minute what word wide. Them writer occur among.,2024-10-02
1002,84,82,2,Thought guy leg man whom sense. Drug example worry involve. Industry just moment smile fact issue friend present.,2024-10-21
1003,311,155,4,Affect him since another you bill. Large which glass person.,2024-03-13
1004,222,491,2,Already stay gun reason gas.,2024-08-23
1005,293,575,3,Political too thought car statement open white part. Reality too dog why despite easy.,2024-11-29
1006,199,609,5,Community including yes job. Difference sport resource project level yes how party. Thank road view political near sort at.,2024-11-28
1007,409,549,4,While environment because form true high share. Enough will specific capital. There under mention fast plant budget. Use as keep garden young specific news.,2024-07-02
1008,90,798,2,Enough develop everybody mother. Such base leave to our. Third message wind.,2024-11-15
1009,281,429,1,Tend happy understand new.,2024-11-07
1010,422,24,3,Tend house cold for. Dog fact surface window boy. Commercial almost difference.,2024-10-12
1011,281,580,3,Agent thing us chance month well. Learn scientist others person main.,2023-12-27
1012,160,225,1,Drive north trip develop total. Check data myself. Clear center across home case establish.,2024-09-27
1013,267,831,4,If against especially talk range mean citizen. Real participant player whole option ten company.,2024-11-27
1014,351,198,1,Ok still star today another wide cost student. Similar she return you. Lead close quite make. Degree moment recently majority first kitchen.,2024-11-22
1015,414,665,4,His entire party trial. General fall central act smile forward performance.,2024-11-12
1016,457,294,3,Write million set mother. Will participant hospital vote.,2024-08-19
1017,126,888,4,Later enjoy next forget brother style. Do high trial indicate.,2024-11-29
1018,239,806,2,Allow product table need others. Design security wind player past four sign.,2024-11-06
1019,340,560,3,Exactly prevent arrive coach. Cut possible member water population should right. Build realize show reduce direction.,2024-10-03
1020,278,104,3,Agency worker commercial. Across city remember its.,2024-05-25
1021,216,290,3,Somebody one bill local what ability finish. Represent lot plan. Mind contain trade approach prove.,2024-10-21
1022,458,959,1,Success body next. Note community next. Both when about system. Such morning memory free three black mean.,2024-09-07
1023,201,948,2,Happen wish sometimes their toward computer. Tend organization two to happy.,2024-10-22
1024,77,660,4,Any long ok fish few win company. Growth product watch. Dinner artist hear morning lot find so.,2024-04-09
1025,23,568,2,Enter character fact trade. Around magazine out member child to.,2024-09-14
1026,21,849,3,Blood factor site.,2024-11-11
1027,25,96,3,Its art kid ago.,2024-04-20
1028,173,620,5,Effort each civil. We town pattern understand. Me speech he.,2024-10-11
1029,193,945,2,Simple matter avoid building nearly. Seek visit economy computer.,2024-07-16
1030,339,384,3,Gun probably kid the. Save offer for less travel respond official. Responsibility probably friend manager.,2024-11-02
1031,448,465,2,Nearly possible between series interest right. Hold speak current hour. Doctor factor budget be yourself.,2024-11-27
1032,165,190,1,Reflect off north charge guess. Entire under agreement rock environmental. History rather beautiful consider again team technology hospital. Investment stuff believe amount.,2024-09-30
1033,162,588,1,Industry also major manage meet on money. Range church including vote design cup.,2024-07-16
1034,473,1,4,Score tonight minute garden situation choice serve. Memory fill pretty reality green great rich. Ahead easy both force page friend democratic. Available green can few media.,2024-11-28
1035,85,800,4,Away environment show water paper control. Improve bad onto language reach east fear later. Practice feeling food method interest hotel.,2024-10-12
1036,93,943,3,Rather worker role wife today bill interest. Boy adult fear front city fight subject.,2024-11-19
1037,364,662,4,Among most for begin technology seem. Try television crime husband break fast behavior.,2024-11-24
1038,266,732,3,Let with easy left day book training. Final card worker realize baby article industry history. True across decide new security people.,2024-10-06
1039,111,712,3,Once Republican provide investment whole article. Play fund food yard option specific form.,2024-07-05
1040,185,927,5,Listen finish arrive air. Source bit culture personal third hospital.,2024-11-29
1041,396,477,5,High determine worry stuff. Ahead purpose simply.,2023-10-27
1042,215,855,5,Send dark about store her movement security.,2024-04-30
1043,465,601,5,Face image ready in. My treatment enter assume simple character.,2024-08-01
1044,320,838,1,Lot anything challenge century. Matter wind final toward. Safe cultural address senior through production. City their free.,2024-11-12
1045,158,919,2,Find check easy one newspaper body boy friend. Them too beat range push thus reflect. However recognize five majority world.,2024-11-29
1046,238,935,1,But billion economic cost these our rest follow. This ability crime director heavy member.,2024-03-28
1047,113,995,3,Of evidence area agree some head. Reach current road right part easy. Floor former south young his bag entire.,2024-11-13
1048,255,988,2,Cover event which dog again. Listen final magazine risk activity.,2024-08-01
1049,162,679,5,Work expect better notice book interesting bring room. Change effort five such.,2024-11-14
1050,93,450,5,House community drop care I mouth central become. Life central how property above.,2024-11-09
1051,11,811,5,Action message process deal address task finally organization. Arm late view voice maybe. Another support listen well.,2024-03-27
1052,119,929,2,Yes light may represent. Throughout attack conference. Thing not because there anything stay.,2024-09-23
1053,91,677,3,Few ago community against cut. Save thing threat bill certain material. Despite professor eye after usually. Sign available yard son standard final none.,2024-08-18
1054,374,343,3,Build computer energy realize. Consider between site news family leader hour.,2024-11-06
1055,50,401,2,International green no than seven various without. Rate break tend spend value push onto.,2024-11-18
1056,406,670,4,Argue difficult energy somebody show beat threat life. Hotel vote some such. Per anyone yourself there person usually.,2024-11-29
1057,112,423,5,Dream way design your since. Account success customer decision become individual message drive. Model follow at effort himself during hotel which.,2024-11-07
1058,176,579,1,On question off among brother. Thousand doctor civil. Mind whose personal buy.,2024-10-28
1059,482,110,3,Majority daughter together moment allow raise because sense. Fine hand six machine rock guy represent.,2024-11-17
1060,38,383,1,Ago sing many recently treat apply research. Specific picture nice reason. Office public leave author though throw.,2024-11-29
1061,70,158,3,Ask win area foot. Home operation blood spend wear. Often lay not there oil hot entire. Difficult easy hear can.,2024-06-27
1062,184,97,1,Arm product glass fact discussion finally think expect. Star read industry important boy.,2024-11-23
1063,296,346,3,Effort cup product station role and official still. Media travel step police defense here. Adult different teach front. Entire can build forward beyond professor bit more.,2024-08-31
1064,235,407,2,Degree reflect movie short. Center huge visit loss become everybody would. Election four my carry road.,2024-08-30
1065,130,130,2,Child quickly organization performance notice number party. Area tree build might standard officer company interest.,2024-11-24
1066,394,338,2,Last argue pressure happy year although. Test condition garden region.,2024-11-12
1067,68,100,2,Development opportunity well. Section deep brother home lose thousand. Man little participant thousand risk short buy.,2024-11-12
1068,134,580,3,Analysis suggest final recognize. View man life bit system. Themselves personal design quite value but.,2024-09-18
1069,233,215,2,Network yard often field. Election yet should time else arm friend.,2024-09-12
1070,259,44,5,Arm his carry lawyer. Painting see picture adult. Without pressure number hit above door.,2024-11-27
1071,160,629,3,Weight walk across none least dog strategy. Campaign medical meet pattern risk put rate. Character wait wide wide next Mrs.,2024-11-27
1072,380,224,5,Item simply college material window. Age decision skin.,2024-11-15
1073,363,570,3,Especially at factor. As day mention standard senior condition. Wish kind size boy have focus real nation.,2024-10-11
1074,254,120,1,Series add next important. Right nation nearly.,2024-10-19
1075,477,788,4,Meet federal low entire. Quality win blue wonder fund place ahead.,2024-10-15
1076,429,346,2,Value partner interesting on art. Always finish admit investment care man would.,2024-09-26
1077,478,143,2,Improve these arrive know instead if particularly. Safe certainly respond look film. Like he position peace indicate. How understand around idea.,2024-08-25
1078,115,415,1,Film last pick. Movie rock despite down game agree Democrat. Hour almost step test foreign decade.,2024-09-10
1079,167,80,1,Sing ball wish might stock per. Cover avoid life issue street take chance.,2024-11-12
1080,456,718,1,Upon build air eye. Structure officer great billion air close.,2024-09-28
1081,209,727,5,Study back customer. May bar several after sign.,2024-10-09
1082,459,771,4,Somebody lead single item task five. Single tough both class many. No sometimes prevent face fear that.,2024-05-13
1083,58,773,5,Tax meeting language. Product deep color office. Respond site yourself fund ability financial.,2024-05-08
1084,18,486,4,From hospital watch vote. Appear movie hot stock glass stuff look central. Me physical near analysis generation behavior life teacher.,2024-09-04
