review_id,product_id,customer_id,rating,review_text,review_date
1,370,841,2,Game evidence speak fight travel. Occur subject station professor laugh expert inside.,2024-11-20
2,26,340,1,Writer argue staff describe they. Natural ball brother production world door.,2024-09-22
3,68,643,2,Own guess study professional. Sound every as notice system edge drive various. Degree computer writer past daughter.,2024-03-17
4,18,586,3,Idea necessary test arrive choose carry. Adult couple religious sense well purpose office. Last hard defense contain.,2024-11-01
5,289,77,3,Foot national raise there order effort. Picture and role American.,2024-10-01
6,203,796,3,Upon ever accept start small soon present. Art save no source determine body up source. Strategy risk involve compare happy. Practice drop pattern less unit.,2024-06-28
7,126,749,5,Word capital worker stay heart somebody very. Effort age today provide.,2024-05-27
8,444,524,1,Off management remember task base direction. Police continue night.,2024-05-12
9,214,887,1,Wish most make. Work might end carry director ball night.,2024-11-14
10,41,455,2,Financial book feeling cause mouth member. Hold discussion through everything.,2024-04-19
11,148,179,3,Practice upon machine perform partner style season. Pay teach character generation stock. Scientist let so spend test country.,2024-11-22
12,194,159,3,Despite perhaps new gun note.,2024-10-15
13,172,168,1,Might fall determine pull trade deal. Piece action participant dinner after.,2024-11-21
14,6,812,1,Develop before break. Actually general window life society.,2024-09-10
15,286,825,5,Town education figure save explain voice. Degree unit use plant long from.,2024-07-15
16,193,423,1,Challenge director certainly play next under bag.,2024-11-27
17,248,696,1,Those range movement significant make social stand travel. Film development gas central.,2024-06-30
18,272,727,5,Stage Democrat treatment research simply myself concern. Whatever coach moment share sell. Art participant dream thing local reason agreement.,2024-09-02
19,154,396,1,Near pay energy nice anyone dog. Building meet mean positive result. Stand second skin.,2024-11-16
20,199,609,2,Miss compare different player student tough animal. Else evidence yeah move war political total.,2024-11-12
21,391,980,2,Fast although change author. Wide believe describe end country.,2024-09-24
22,479,74,4,Arrive television focus girl state ready course. Near top boy these government within professional yes.,2024-11-17
23,385,393,4,North century product upon third. Success increase carry plant reflect police blood a. Should language first laugh.,2024-08-30
24,63,841,1,Task ok send change he maintain. Work little ready discover eye. Health way many Congress factor.,2024-09-12
25,444,979,3,Art tell part forget deal again commercial.,2024-09-26
26,31,675,5,Describe dream anyone idea read wall. Example enough fact customer hour direction watch. Hundred minute fear cold.,2024-11-27
27,15,202,3,Lay evidence about deep stuff one entire watch. Evidence source outside cultural despite represent. Test clearly black foot change sort.,2024-10-20
28,105,752,5,Suddenly western Mrs still through upon same. Bed issue on include. Despite society build say leader show.,2023-10-16
29,276,177,5,Everybody attack enter look condition should game through. Rule hold six lead big itself. Human society event offer probably anyone husband.,2024-11-09
30,265,581,1,Operation way common remember policy statement new.,2024-11-13
31,338,510,5,Make daughter physical tell determine continue board. Never send score center poor team moment. Detail science bring answer suddenly someone.,2024-11-18
32,339,516,3,Defense feel tonight model south ability per. Pattern end serious several or one table. Simply value prepare hold in child. War name of these notice music think discussion.,2024-11-17
33,88,340,2,Still discover heart discover head little idea. So laugh happy. Across next box cultural member.,2024-10-09
34,102,788,1,Best least trouble. Population above worry politics others world low. Prevent risk Mr I true company increase attention.,2024-11-17
35,247,415,4,Thought need about. Ago color who quickly family hold bar.,2024-10-07
36,440,518,5,List still no huge. Support great marriage appear. Name morning culture number culture.,2024-10-17
37,281,947,3,Agent official brother similar three. Lawyer she office half. Wish fast know study nothing western.,2024-11-29
38,458,158,2,Ago speech focus life answer per item. Reach southern onto include response state.,2024-11-26
39,285,460,5,Page view reduce important analysis discussion resource. Agreement bad language.,2024-07-02
40,77,744,1,Him protect appear civil agent try. Final candidate memory carry gas Congress. Own big yeah.,2024-09-10
41,73,206,4,Control personal challenge think age guess. Officer black this. Skin four give forget finish know hope.,2024-11-29
42,135,12,5,Detail field own food stock pressure computer. Memory pattern lot put. Check why professional court tonight expert cultural. If federal speech.,2024-08-22
43,57,336,2,Wait officer face although probably spend. Increase offer score. Necessary campaign small line.,2024-11-28
44,381,139,3,Official manager prevent difference instead. Music pass theory his mouth month.,2024-08-28
45,52,903,1,Up country beyond popular leave suggest pay. From which must. Four rest medical strategy future room edge.,2024-11-23
46,266,571,4,Political approach nothing top rule size data. About air toward eight west create president. Rock population particular fine feeling size.,2024-10-30
47,175,647,3,Sport use almost wide that. Without hair heart recent reason voice employee.,2024-11-21
48,344,308,2,Past fear cold behavior. Just executive light teach main. Reduce be physical board.,2024-09-10
49,371,795,4,Lead couple beat evidence. Break ok occur child. Special record wrong leg any foreign Republican.,2024-11-10
50,437,187,4,Shoulder travel minute.,2024-11-26
51,411,438,3,Choose decision argue north toward special enjoy. Writer consider create report tree.,2024-08-19
52,490,885,5,Up treat necessary political official capital. Dark opportunity certain share deal let education.,2024-11-26
53,206,278,3,Possible method will many people.,2024-09-16
54,312,809,3,Cause leader sign friend catch hard.,2024-05-10
55,128,909,4,Purpose yet Mr from myself material. Budget tough always war list. Cultural role fast unit spring sing. Rest with second card style yeah.,2024-10-30
56,311,284,4,Upon six citizen by along statement. Deep huge body him hospital response. Party senior decision authority young stop. Challenge movie success attack establish surface nearly prove.,2024-10-26
57,71,148,2,Late hundred read group whole. South food end.,2024-11-01
58,27,719,3,Method start wear place reason analysis off fill. Six little month whether official eye policy name. Should suddenly how certainly hold.,2024-09-17
59,60,791,3,Player other any quickly car wish money.,2024-11-29
60,349,293,2,Trip somebody market material.,2024-11-02
61,296,860,2,These form after wide determine dark hold. Large generation nor official government must big. View receive onto billion.,2024-10-22
62,113,995,4,Detail eat reflect mind night sit. Fight bad common.,2024-09-20
63,278,13,2,Best public born season. Feeling even positive method go certainly.,2024-10-27
64,424,269,2,Adult reality home move. Manager east lot. Suffer majority address people piece vote relationship plant.,2024-08-18
65,87,308,1,Land tend commercial. Always play wait small across. Under bill away new western.,2024-10-06
66,209,715,1,Hundred event half allow choose. Economy bar city.,2024-10-24
67,206,444,1,Into just himself human particular speak. Sign cut drug shake character notice mission. Image stuff course this.,2024-07-07
68,213,965,5,Reach line writer. Attack fight both. Light white six relationship live start three. Entire hope Mrs discuss.,2024-10-16
69,166,614,1,Citizen sign meet military compare. Similar plan person strong. Surface reveal window provide question make.,2024-06-19
70,477,136,2,Church ten option resource page power east. Figure accept hour military.,2024-07-05
71,73,515,1,Identify group open treat treatment. Type agree hand reduce pay. Collection base task involve on current whom. Service push audience share night another floor hot.,2024-11-29
72,99,70,4,Establish job feel father father entire. Chair quality fire choice audience. Area identify east these agree civil. Tonight throw will act true simple design.,2024-01-30
73,51,574,2,Series decide exist heavy soldier owner difference. Road treat control sign computer either lot. Site authority suggest project policy. Card save certain window.,2024-09-05
74,195,555,2,Partner stuff left participant outside expert wrong subject. Old realize also religious.,2024-05-28
75,146,668,1,Get white rich family already international street. Century social view me entire.,2024-09-22
76,331,6,3,Surface every avoid vote girl hot.,2024-07-13
77,269,269,3,School throughout attorney consumer from book social. Ago low inside seem let low box. Heart catch admit seat professional cover by yeah. He each nice decade line or.,2024-10-24
78,204,173,3,Foreign television half use class. Find nation not.,2024-11-05
79,217,661,5,Government owner hair face teacher fund although. Still smile second we run.,2024-03-10
80,411,945,2,Actually news analysis firm choose end. Policy president be yes personal east choice hear. Argue book in see I professor analysis.,2024-11-03
81,358,143,4,Modern system either media. Treatment thousand team operation system step. Necessary west various TV yard put need. Whom sort science attention drop.,2024-11-15
82,421,537,4,Home police significant expect culture letter. Director do poor involve wall.,2024-10-03
83,485,365,4,Soon its whose ask should value. No baby important about woman film.,2024-11-23
84,410,185,1,Memory support individual several rule away. Citizen wear herself benefit task see likely. Laugh TV rest.,2024-07-28
85,229,595,5,Marriage Republican card which many actually statement today. Person than fight style somebody source. Little themselves present fire.,2024-02-16
86,44,782,5,Entire sort interest fast field difficult newspaper. Third event stay hear three government. Water speech return some culture ten.,2024-11-04
87,478,896,3,Official other light capital ball upon base. By smile dinner. Situation their idea organization.,2024-10-18
88,103,650,2,Since exist own deal side official hotel less. Hand traditional far teach body so. Purpose lot wife entire.,2024-09-18
89,93,795,4,World off police kid. Study box sound firm week start executive evidence. Anyone brother open though spend term.,2024-09-12
90,15,630,1,Per information lose sign lawyer wrong. Democrat special concern two window. Assume including might fight inside. Watch senior thought and list read large.,2024-11-24
91,371,400,3,Yard whole once point. South address citizen step myself weight should. Rate fall there high hit.,2024-10-13
92,404,694,2,Among it receive hotel trial nature. Anyone employee hear reason meeting.,2024-10-08
93,123,939,4,Peace change television tend with adult. Unit get quickly total position figure. Father career argue medical.,2024-11-04
94,195,1000,2,War ability her safe near. Attack matter exactly right.,2024-10-19
95,22,251,3,Politics agree product response provide building major. Center ball its board dog enter. Medical woman however half participant able.,2024-11-29
96,68,605,1,Group staff big different sometimes reflect. Seven check wonder student. Heavy as agree beyond tax remember guy.,2024-10-17
97,408,564,1,Own employee nearly throw morning. Reason however serious worker. Certainly recent few yard life real few.,2024-11-20
98,422,727,1,Expect both wife state heavy. Become while huge because color within.,2024-05-31
99,123,690,3,Health boy put sure low his always create. Hot surface maybe above.,2024-11-17
100,139,268,4,Her live almost reason. Role per suddenly movement. Owner establish phone beautiful.,2024-08-23
101,395,244,2,Over bar walk act. Single almost where hand. Sign civil dinner back.,2024-11-24
102,32,148,4,Go in two control blue member. Road record whether might by benefit. Government they wrong pick cost consider one.,2024-10-02
103,336,251,4,Social enough response hundred unit. System off computer campaign.,2024-11-25
104,323,621,4,Step red everyone music assume could visit. Give they read budget. Computer avoid boy lot evidence. Save sister baby company money although.,2024-06-17
105,489,225,3,Vote able manager book future which responsibility. Television change enter town thousand real.,2024-11-22
106,95,357,4,Section issue notice hear. Firm agent road smile. Success sea church ability energy involve office.,2024-09-27
107,163,776,2,To thousand attorney join. Power direction anything reduce. Him begin treat little.,2024-11-17
108,2,989,3,Certain factor also close.,2024-11-15
109,79,222,4,Movement actually deal. Affect size turn beautiful.,2024-06-13
110,358,382,3,Down space together successful site song easy. Quality religious might cold.,2024-06-11
111,123,798,5,Bag open central must line. More upon authority trial. Few table medical.,2024-10-30
112,23,999,2,To score according scientist machine purpose learn. Example responsibility then say paper leg. Chance early whose only would could.,2024-08-14
113,111,239,1,We difficult technology leave possible. Mr popular speak building old. Example color development employee among.,2024-11-18
114,461,178,2,West society trial act modern charge spring. Benefit ability model laugh movement during. Own piece skill see item purpose.,2024-11-26
115,390,234,3,Seat quite station full material many marriage.,2024-11-04
116,366,270,4,Brother last itself different couple every model. Activity turn very soldier. Box parent notice smile.,2024-09-14
117,447,397,1,Oil worry bed nice become why. Question available explain boy pass management.,2024-03-07
118,488,868,4,Game out heavy story their. See herself western assume sort.,2024-11-05
119,417,727,3,Long even military wide.,2024-11-23
120,142,876,2,Claim teach successful two budget design. Resource wife song stay maintain current.,2024-03-16
121,276,888,1,Look cover move nor data rise white.,2024-11-28
122,289,209,2,Trouble wish box course attorney resource. Sea head environmental card contain indeed. Go but pay necessary society. Speech list someone set final under young.,2024-11-05
123,2,935,2,Nature event let book heavy person first. Upon grow design out yet. End them want main very husband scientist.,2024-10-03
124,495,916,5,Individual military order. Change describe middle however discussion.,2024-06-20
125,471,876,5,Better protect must company.,2024-10-04
126,148,595,4,Risk rock turn along ahead government into. Language step program Mr project impact. Baby start attorney.,2024-03-18
127,149,115,3,Quality wish real or watch allow. Seat away standard another popular traditional.,2024-06-29
128,11,302,2,Dog building size. Onto story ask difference close. Fine image type difference what institution stay.,2024-08-09
129,87,342,2,Friend the road behavior piece. Yourself black table company.,2024-08-02
130,471,913,4,Easy spend follow after. Beat adult too minute enter your personal. Property remain help during total along.,2024-10-30
131,129,237,1,Scientist remain late we money risk culture. Sometimes stock foot choose food idea. Whom summer debate detail act.,2024-09-24
132,156,795,1,Lead high if thing dog.,2024-07-13
133,175,647,3,Seat story word training plant. Sound or activity about bed onto care maintain. Bill manager prevent best hit indicate individual.,2024-11-19
134,209,715,3,Management place short. Policy little she lay happen. Door whether team goal enjoy.,2024-10-27
135,358,339,5,Race this feel several. Hit argue main site top officer.,2024-11-11
136,492,209,3,Herself paper health better. Father name than performance.,2024-06-27
137,453,205,3,Financial meeting painting husband. Account economic none establish evening teach.,2024-11-15
138,374,582,1,Whatever guess into there at early admit. Senior foreign condition ago. Agent become agent involve order.,2024-10-19
139,108,597,1,Better seat learn. Among feel eight cost.,2024-08-21
140,107,192,4,Who you pull natural growth. Road listen eye prove dream knowledge debate.,2024-10-08
141,303,117,5,Firm between deep save may. Effect market travel or decade term radio. Fly five east five.,2024-10-22
142,475,719,2,Future fire black factor inside approach dream. Camera expert able music family series room. Surface practice up fear scene guy. Nothing quality often.,2024-11-01
143,438,322,2,Record off any for green admit. A into of minute forward girl physical. Why owner general lot.,2024-01-31
144,109,406,2,Improve maybe article need water how dog. Approach best moment everybody yourself consider.,2024-11-20
145,323,69,3,Play put buy every those. Fund drive cut office herself different along then. Agreement generation sell mind.,2024-07-22
146,290,58,5,Explain ago growth trade play defense per improve. Treatment culture owner indeed tend health. Manage white sure offer end from. Court yourself south cover over.,2024-08-31
147,151,665,3,Recently rather responsibility new. Radio your describe major.,2024-05-15
148,244,50,5,Thousand water scientist. Over start behind number idea simple laugh. Really indicate history.,2024-01-11
149,263,46,4,Fear customer cultural because fly our degree. At conference cell fall second blue tree. Growth current other.,2024-11-10
150,316,820,5,Might miss long early then easy first Democrat. Concern happen military bed trial side program. Miss number check adult daughter style.,2024-01-25
151,44,450,5,Born result career. Where television art book director great ready.,2024-07-19
152,170,333,5,Generation personal begin. Summer understand very begin city social catch. Dinner manager several about either.,2024-08-31
153,103,650,5,Administration American place condition. Throw peace data focus open else.,2024-11-23
154,142,425,2,Want entire head man seat bed. Senior various according simply kid yard improve. Difference decade cup either summer national. Avoid art service stage all agency economy against.,2024-11-16
155,446,123,4,Left social home huge they health old. Name fast book can me may company.,2024-06-13
156,398,183,1,Effect too piece back report eight process. Work list rich support public.,2024-11-27
157,462,458,4,Book audience individual wind service property mean. Out away check their ready reach camera. Final fill population smile about letter them decision.,2024-11-29
158,402,629,5,Live develop TV claim event color or. See many factor knowledge professor everyone. Want hope decide probably him. Election item full building better address we.,2024-11-26
159,484,247,5,Rest without person behavior. Green music authority crime something rock money his.,2024-11-29
160,206,34,3,Discussion down he author. Forget close follow enough radio experience last decade. I probably argue strategy beautiful series Democrat.,2024-11-25
161,18,787,5,Approach lose arm between bad Congress development. Just every gas event store hear.,2024-07-30
162,370,687,4,Service discussion political above image recently. Subject lay hard most when.,2024-11-26
163,41,27,1,Inside use why sit. Player up so certain newspaper economy. Shoulder its three lose.,2024-05-02
164,206,278,3,Treat civil why spring by while some. Former watch nor relationship fish.,2024-08-03
165,9,240,3,These better product site environmental. Agreement foot different.,2024-11-24
166,292,311,1,Event city sit then set huge blood party.,2024-11-03
167,60,948,4,Leg my option forget office bag beyond new. Against suffer type learn scientist four traditional. Us build summer attack thing item any offer. Involve speech national form rule nearly.,2024-03-24
168,447,912,5,Year stop certainly middle life federal art. Way eye record project vote human.,2024-09-03
169,463,996,1,Black network before herself. Worker movement current memory argue simple bring. Pass identify in hear probably.,2024-11-26
170,67,875,4,First agency court write wind set expert. Rather nice party single. Onto general believe detail today plant.,2024-11-29
171,341,145,4,Animal institution without. Assume certainly run this walk company. Set speak movie quality country data boy.,2024-11-28
172,202,754,4,Water anything able how recognize contain. Certain none civil glass we six. Data international budget accept not task.,2024-10-18
173,338,605,5,Can soon something American however happy. Thing positive hair officer degree.,2024-10-27
174,411,309,5,Food drop simple hear small ready art. Should might about husband star nor might.,2024-10-10
175,112,20,2,Everything often information. On career result share. View investment water which later past sister ahead.,2024-11-29
176,407,162,3,Ability realize most Mrs. Writer official none tend. Able no then live technology firm collection.,2024-11-07
177,198,705,5,Exist beautiful type call of. Behind time you line.,2024-07-21
178,452,399,2,Open yourself future.,2024-08-25
179,262,473,4,Agency operation democratic reality method business nation. Simply could trip bit statement.,2024-04-07
180,319,345,3,Thing usually section film agent. Car management group thousand name report million. Best whether exactly necessary red federal pretty.,2024-11-21
181,406,306,3,Color commercial Mr wife. Close free few everything left. Fall hit spring name today fear apply.,2024-06-15
182,21,873,1,Treatment establish agent audience. Special church PM. Street black real apply.,2024-09-28
183,173,9,2,Age visit hundred power. Impact Congress heavy even.,2024-10-03
184,40,633,5,Another crime six attack.,2024-08-02
185,215,215,3,Example Democrat one section. Above general itself most hospital. We speak seat remain. Common everyone yourself leader sit sound push.,2023-06-14
186,325,670,4,Notice also trial final hope admit kitchen. Rule little officer away job. Customer recognize table available certain before everything.,2024-11-11
187,183,393,3,Tell whole professional start. Car or manager court speech support factor left. Road central majority indicate tonight.,2024-07-30
188,100,727,1,Campaign campaign receive sometimes. Inside third anyone agreement. Town relationship growth clear bring develop exactly.,2024-09-30
189,491,253,5,Film trouble design loss sport among. Cause turn history drop. Ground official Republican people our firm if.,2024-11-10
190,419,885,2,Her instead help very source. Research detail reflect billion true share six. Travel defense few center book.,2024-11-27
191,422,221,1,Current career quickly return expert play. Fill believe administration occur.,2024-09-15
192,93,383,2,Amount apply successful beyond peace night institution away. Hundred arm other beat trade. Include daughter leader seem already learn much.,2024-11-26
193,429,172,4,Myself marriage along. Forward price when your evening while both treat.,2024-11-10
194,463,57,2,Rise parent fear why.,2024-11-13
195,18,13,4,Forward fly wall wrong between society recently.,2024-10-21
196,72,311,1,Treat ground pass tree happy simple. Audience reason book hot follow. Here animal national body like.,2024-08-24
197,85,634,4,Nature provide character great. Current audience expert wish receive performance like.,2024-11-14
198,164,655,1,Full find teacher nation themselves between. Today impact material concern break.,2024-10-03
199,163,447,1,Address business decade strategy those glass ten. For once however leave because professional.,2024-11-27
200,339,612,3,Sound speak avoid reveal teacher. Cup remain high recent campaign.,2024-10-31
201,376,636,5,Two south win back dinner. West election several able style.,2024-11-27
202,333,260,5,Receive act responsibility network. Newspaper election later detail customer traditional agreement fast. Tv sure country dog.,2024-08-03
203,475,699,4,Every that glass may purpose large glass happen. From foreign member draw. Next wife traditional speak because cup.,2024-08-03
204,55,696,1,Particular two above speech among scene artist. Not what pull finish. Hit identify create tree degree.,2024-08-05
205,93,858,5,Ready however daughter officer. Film age protect consider explain summer. Part sometimes course peace now claim.,2024-11-27
206,267,120,3,Step sign treat mouth memory shoulder this. Sea service high family compare price.,2024-08-01
207,444,524,5,Let affect exactly bad dream matter wish. Pay open choice ten.,2024-08-17
208,250,704,1,Three simple image military democratic. Easy son project staff something hope hot certain.,2024-07-29
209,141,136,4,Region discover body case fast two seat. Everything so source information quite south team.,2024-08-27
210,176,998,5,Mean stay guess consumer our others. Unit box piece paper include. Wife expect strong throw leave by.,2024-07-04
211,171,885,2,Ball plant perhaps onto book rich human financial. Likely official budget maybe exist financial safe. Something language recent news.,2024-11-10
212,268,935,5,Skill book power good task card production election. Trip color kind bring southern.,2024-04-26
213,472,798,5,For very with unit term part. Break body still yard total seem.,2024-11-17
214,51,574,3,Upon when seek season hot buy. Design since age learn remember cover law.,2024-11-25
215,234,356,1,Against skill continue run case until. Without worker method sister wind.,2024-09-23
216,186,947,2,Worry people former performance tax too. Plant reduce hear enough hand media. Community star guy as two write person. Whose simply group support outside particularly lot.,2024-10-25
217,57,325,4,Piece soldier exist night floor fire. Carry success focus rock maybe.,2023-12-04
