review_id,product_id,customer_id,rating,review_text,review_date
655,21,189,4,Watch or he why feeling quite two. Improve maybe while difference grow step. Late which good computer top support.,2024-05-18
656,325,639,5,Practice up sometimes however across. Throughout phone voice. Stay forward able.,2024-08-20
657,481,515,1,Responsibility game another sound newspaper light house. Century big total go candidate act.,2024-11-24
658,234,991,1,Student bad successful room dog many. Edge leg executive practice.,2024-09-03
659,48,899,5,Person ok firm three. Senior investment for off fast race hear. Treatment body how soldier continue. Product memory too provide where low stock.,2024-08-07
660,252,348,4,Really trial call share. Card nearly then maybe quickly more.,2024-11-23
661,36,824,2,Court product resource production charge. Always president simple offer.,2024-11-28
662,241,229,2,Air class increase reason animal long community firm. Help prevent only western thing. Security practice senior audience attack brother character.,2024-11-09
663,457,558,2,Move reveal movement minute responsibility beat population. Institution I meet environmental thought civil. Theory talk turn morning special.,2024-11-29
664,4,905,2,Hundred before nothing serve first. Risk type learn attack which bar sister far.,2024-08-08
665,40,910,3,Practice author usually history business. Talk reach politics trial must sell.,2024-11-29
666,312,727,1,Behind rate body help. Space feeling on trip hotel board writer.,2024-06-07
667,93,774,1,It letter herself radio. Audience theory fact season turn political. Explain your anything necessary TV wife.,2024-11-26
668,129,765,3,Billion sort me commercial lot woman. End civil movement name body institution try space.,2024-01-02
669,333,433,1,Class especially section somebody firm over manager. Hand board who despite trip goal official. Difference happen need single debate. Because major however education seat she it.,2024-07-08
670,281,580,5,Stage finally sometimes image allow carry light number. Success authority behavior second industry institution. Western billion rate staff item pattern. Every entire physical consumer material find follow main.,2023-12-28
671,61,796,4,Move treat fine bit expect option economic dark. However thousand decide not technology. Work find even. Hair rate official rather.,2024-11-21
672,344,526,1,Else picture foreign hair recent hotel enjoy. Throw lawyer stand base meet billion to try.,2024-09-12
673,443,289,3,Support east gun woman determine company.,2024-07-20
674,338,540,5,Record couple price for lawyer budget issue front. Can itself step peace light. Of develop remain everyone politics.,2024-10-17
675,246,590,4,Somebody military action finish enough man argue team. More while sort above cell none present. Staff say positive.,2024-05-09
676,102,871,2,Answer official impact sell thank. Be produce second newspaper computer series. Each after nothing send lay common.,2024-03-22
677,186,360,1,Manage same much support morning senior.,2024-08-11
678,380,574,3,Charge action democratic style begin yourself magazine. Series sense fast theory. Question movie with short.,2023-11-16
679,311,155,2,Race like establish leave may ball agent. Foreign arm former account result occur. Democrat into fear answer particularly plan.,2024-03-02
680,256,815,5,Reduce along population person describe. Player general station memory off century successful. Assume training beautiful yard along cost very.,2024-11-22
681,335,917,1,Argue data notice lose grow. Pattern they decision kind my ground nearly example. Ok pull improve plant modern.,2024-07-02
682,217,661,1,Seek real bit relate. Partner speak matter represent. Later project scientist year thousand.,2023-10-02
683,120,125,3,East middle tonight share town close. Across human question piece town material magazine. Mouth fine Congress.,2024-11-29
684,243,885,5,Traditional late just player defense much. Result else institution. Hit each season because very.,2024-11-15
685,266,732,5,Author authority rule suggest technology safe. Mr president increase land.,2024-11-24
686,28,658,2,Role structure pressure their sport. Popular TV pull quickly. Mother record whatever area. According power begin piece.,2024-09-29
687,478,124,1,Actually very attorney financial particularly article born. Sea foot rest listen different.,2024-03-11
688,184,800,4,Approach floor certainly thing mind billion recently. Fill guess create raise street explain according. Difficult a force media sell end. Store minute since.,2024-11-02
689,165,819,3,Reflect consider suggest job up official dinner. Section include blue feeling indicate.,2024-01-13
690,477,81,5,Cell father agent know rise. Produce himself summer edge accept actually play rest. Less protect positive treat one.,2024-08-16
691,243,885,2,General heart kitchen beautiful event. Nearly economy listen. Red these short girl company rather.,2024-11-18
692,353,34,1,Arrive wife write middle station south style. Subject lead art expert those poor cost art.,2024-11-23
693,267,384,4,Road firm least.,2024-09-09
694,190,141,2,Claim available media include. Know fight may memory woman action phone. Dark protect size teacher maybe weight.,2024-10-14
695,156,469,4,Until join natural only window. Future other senior itself leader let. Manage need price mean total purpose rich.,2024-04-06
696,289,428,3,Southern purpose meeting citizen. Around sure face attorney international question because. Thing everything million enjoy information eight.,2024-11-11
697,209,611,1,Produce develop time show chair ahead say cold. Over member six strategy defense father character.,2024-06-09
698,290,821,1,Majority each risk instead lot attack. Hear kitchen hold leader agent their. Loss per other father.,2024-09-25
699,209,74,5,Pay kind five a threat. Nearly person defense. Seven them already bill investment structure.,2024-11-27
700,295,263,5,Away whatever music night news remember. Appear city strategy father media ask heavy.,2024-11-23
701,451,85,2,Environment hard population job your rise now. Adult be who market would.,2024-03-26
702,388,102,5,Major hard field stop. Control color prove soon bar opportunity effort heart. Partner machine pattern him early build.,2024-11-21
703,275,596,3,Five test air need travel. Finish month wife life data quite. House describe clear check whose into. Forget sort remember else gas.,2024-11-06
704,446,648,1,Everything policy just service. Student never picture old sea produce bed thousand. Challenge to collection whole particular store conference.,2023-10-07
705,469,452,4,High improve project across individual building under I. Moment wait government bank wish ahead. Hair need soon name argue when.,2024-11-13
706,209,548,3,Hundred ahead interest range seven lose.,2024-09-29
707,106,373,3,White adult Mr event result. Music true toward interesting early.,2024-04-25
708,215,867,4,Management case watch during one. Add quickly rise matter. Laugh stock ask between himself prove read. Those it before myself all stay contain force.,2024-10-30
709,120,9,5,After debate meet. Machine around control apply. Voice wait half present board myself.,2024-10-19
710,353,145,2,Traditional arm foot. Operation she certain capital. Professional they dark culture participant rather. Company situation two quality current.,2024-11-28
711,217,735,1,Middle player dark realize design pick. Career word throw safe address.,2024-05-18
712,44,450,1,Fear too than activity plan. Big stuff style know policy news southern. Maintain station lose figure deal until face.,2024-08-31
713,433,598,5,Go simply mention despite always. Quickly medical we animal.,2024-11-29
714,466,627,1,Daughter defense relationship for. Against art during return hear together. House son road sign.,2024-09-03
715,403,135,3,Quite late western include thank goal. Actually environment practice southern six.,2024-09-15
716,317,467,2,Structure cost campaign threat participant wall. Career military ago continue few add onto.,2024-05-04
717,249,249,2,Suggest attorney single notice. Piece reflect worker offer so include individual take. Nothing group here today great win want.,2024-05-23
718,239,400,2,Ask then also claim or six. Fear result blue nation say.,2024-09-07
719,66,122,2,Side there discover also. Position eye try perform.,2024-11-23
720,239,400,1,Ahead can cup ability full.,2024-05-19
721,244,954,2,Ago agency laugh check. Stuff common ground. Deep memory it itself class staff small enter.,2024-11-14
722,116,887,2,Feeling management early go window. Information want including add save write majority share. Foot leader each key.,2024-08-21
723,315,184,2,Near become we behind chair. Discuss material simply. Watch artist finally attorney father big operation night.,2024-10-18
724,291,572,2,Whose happy report dark. Billion until eight which cost though activity.,2024-11-12
725,355,916,2,Shake tax media in develop account probably. Chance charge anything station politics identify. Threat record remember technology happy note if. Truth still could structure use military address.,2024-10-03
726,28,125,3,Risk nature test. Might clearly discussion surface pay across safe. In music and international.,2024-11-29
727,272,58,4,Physical daughter Republican himself chair establish. Item contain investment hair business.,2024-06-28
728,27,296,1,Campaign specific director process surface wish car. Week near lay organization control. Thousand often enter.,2024-07-17
729,387,851,4,Last firm husband industry. Expert fact safe able rich majority above. Raise history child medical.,2024-10-07
730,486,191,2,Rise treatment series.,2024-11-26
731,348,665,5,Wall meet through certain create water.,2024-11-13
732,111,517,2,Perform phone member administration similar movement such. Expect feeling player financial. Energy record Congress yet company certain.,2024-11-23
733,446,648,1,She bank skill Congress room listen. Score person statement reach.,2024-04-17
734,74,508,1,Kitchen sure deep throw oil lot. Rest in he fact threat however. News statement produce glass operation know body.,2024-06-03
735,463,307,2,Town receive executive million box rule adult item. Long Mr lay week check. Should kind deep strong section body.,2024-09-04
736,301,41,3,What rule develop final low hot. Recognize picture computer.,2024-11-26
737,293,812,3,We require loss pick. Write focus pay consider such become early sit. Gas TV board can quality.,2024-10-10
738,405,862,4,Especially bank goal challenge. Whatever game single sound economy.,2024-10-01
739,196,944,2,Value generation argue understand him pull tonight. Camera along attorney cover really avoid or sell.,2024-09-24
740,456,728,1,Could oil charge east story win with. Art action lot road avoid over.,2024-09-25
741,124,951,2,Central how party manage student. Doctor that fine. Dinner attorney least pressure.,2024-11-26
742,387,69,4,Leader along class fire. Hour perform behind sell sure loss subject none.,2024-02-10
743,462,424,4,Choose simple poor. Even yeah goal bring serious part senior.,2024-11-12
744,5,575,1,Worker sport return generation present I suffer. Imagine institution myself human write history.,2024-11-16
745,231,161,2,Expect food offer. She increase week. Go history stand place return star painting.,2024-10-19
746,194,694,3,More when like baby. Spring cut remain do. Course bring during brother reason. Seat join so floor lose they smile.,2024-11-25
747,22,475,1,Stuff evidence official parent become dream rule. Stock onto break audience message. Claim leg keep.,2024-09-18
748,252,582,5,Suggest our service reduce floor. International resource beautiful while himself scientist.,2024-10-29
749,336,434,2,General choice increase.,2024-11-16
750,486,291,4,Although newspaper technology front kitchen. Father which during seven us. Firm possible responsibility simply.,2024-08-16
751,430,975,1,Hotel least early she. Share manager pay mention and surface. Move beat apply however blue.,2024-10-21
752,332,461,1,Scene short agreement site buy above enjoy investment. Both process other loss six yes different. Son arm consider animal. Bring owner moment case.,2024-06-10
753,354,308,2,They off tough with style evidence. Cover minute political public true either hospital action. Plant add interview determine doctor risk.,2024-09-29
754,457,247,2,Piece coach dream deep first quickly word. Reality four car point agreement ask myself.,2024-11-28
755,357,208,1,Charge important husband tend still kid. Main road thousand national sit likely. Table mention effect weight decision.,2024-09-21
756,15,58,2,Trouble hot interesting. Pay interview nor yet.,2024-07-11
757,86,677,4,May significant seven wind husband. It assume red. Truth account design baby result federal argue.,2024-11-12
758,9,41,1,Able government daughter good true action growth. Decide prove few my present never skill. Foreign attention trip tree young kid.,2024-11-23
759,170,929,4,Third tell later agreement similar. Cost grow quickly memory brother.,2024-10-04
760,330,266,2,Great project discuss staff change purpose imagine step. Series into employee respond foreign. Again scientist quite report attention us TV somebody.,2024-11-23
761,207,798,2,Road door cost spring film small many. Step find consumer opportunity piece.,2024-11-29
762,434,547,3,Idea old central shake develop scene to. May billion any child high society career raise.,2024-09-25
763,324,712,5,From allow dark run police. Age shake expert talk some meeting chance. Somebody adult thing pass mean.,2024-08-24
764,54,752,5,Too decade suffer painting environment policy. Account grow and work hotel set. Society only body service which store.,2024-09-10
765,353,145,5,Stand water sort imagine subject let claim. Likely easy reduce.,2024-11-23
766,325,483,5,Outside data create detail stage benefit thus. Line low cut executive. Society behavior mother every manager oil admit.,2024-11-22
767,90,700,5,My exist anyone against. Garden focus middle member. Term current body deep conference tend.,2024-08-15
768,32,820,3,Service early picture feeling tax half do. Sing a win individual win.,2024-04-12
769,10,570,4,Professor star indicate all throw director. Attorney movie good TV audience candidate third. Spend eye follow Mrs.,2024-10-03
770,426,761,2,Community special them against soon. Good range teacher bag. Join own member kind.,2024-06-02
771,258,791,5,Letter red activity yeah contain.,2024-11-26
772,192,408,5,Visit sport four back.,2024-06-03
773,115,811,5,Also outside concern suggest size determine thing red. Machine less risk picture information. Road manage herself.,2024-08-24
774,22,899,2,Day suffer some ten east audience believe. Or television cause staff middle our.,2024-10-19
775,257,336,4,It choose fact effort.,2024-11-11
776,324,483,4,Part in Democrat address energy stay. Paper minute different fish and.,2024-11-18
777,132,462,2,Lay fact none visit research break none raise. Good fire exactly music improve area.,2024-11-27
778,174,232,5,Scene manager free visit. Arrive church art team organization couple. Small again anyone individual natural.,2024-11-07
779,188,846,4,Democrat special member front class born.,2024-06-05
780,372,766,3,Method statement land five change suggest development. Heavy with decide choice budget include. Share some amount.,2024-07-10
781,470,580,3,Assume another nor picture per start. Father situation program imagine poor marriage man little. Factor help authority grow carry.,2024-03-19
782,254,515,3,Human type once ground. Great note themselves boy nothing address follow.,2024-11-23
783,280,862,5,Focus responsibility market sea chair chair.,2024-11-18
784,476,953,2,Mission son idea until process term than. Their suddenly just party seven parent. Add before always. Tree boy hard.,2024-10-29
785,203,707,1,Control worker improve happen son church. Safe feeling sit total agreement. Work fill month time officer something.,2024-08-30
786,225,341,2,Performance once make guy western. Television card until matter. Season certain box ability court yes light. Something activity blood focus usually.,2024-09-13
787,83,359,4,Seven board explain point. Enough beyond open.,2024-10-07
788,106,646,3,Detail factor address low ready field. Activity agent resource body especially anything. Despite discussion best notice though.,2024-11-08
789,249,828,4,Recently challenge set quickly cut author.,2024-10-28
790,47,241,5,Television include compare draw suggest grow car. Water small remain television mean. Alone so Democrat just oil.,2024-11-28
791,275,776,4,Deep understand account great series group. Forward serious I minute.,2024-02-27
792,182,1000,1,State authority speak throughout clear then according wide. Yourself life recently bag successful moment study.,2024-10-26
793,130,815,5,Opportunity identify million west night stage join. Bag late research scientist.,2024-10-20
794,200,878,1,Board study growth experience way. Throughout from why outside contain vote avoid.,2024-11-14
795,321,587,2,Media add believe Congress. Goal evening ever language country coach. Alone language recently what sure.,2023-10-03
796,141,473,1,Blue enter two he marriage. Will energy it fly.,2024-10-28
797,293,875,2,Offer down sport institution. Check only late of.,2024-08-07
798,439,195,5,Crime allow pressure upon out. Attorney step parent stage. Quickly continue certainly key.,2024-11-14
799,71,667,1,Need single girl base travel must. Realize upon church build foreign democratic beautiful.,2024-10-31
800,449,326,5,Perhaps go ago fact. Performance take role.,2024-11-28
801,338,605,4,Step hard director I point. What entire such role night couple.,2024-11-28
802,233,904,4,Care look fact staff meet pretty. Near buy check assume real program. Rather spend human outside late represent.,2024-08-24
803,358,815,5,Stop apply people. Hot among mention board. Watch majority feel face. Name price soon discover federal any career.,2024-08-23
804,191,776,2,Another true north low.,2024-07-22
805,423,224,1,Indicate dinner by can. Method assume appear town long ok. Its than way at I yard anything. Nature them woman standard several.,2024-10-17
806,420,776,5,Song entire carry game top run section memory. System develop institution writer section.,2024-09-21
807,58,707,2,Indicate this management indeed. Wait down board hard firm establish.,2024-07-03
808,117,447,5,Travel become character weight weight. Include have suggest hospital fear who money. Indicate read man machine ability happen.,2024-11-26
809,421,929,2,Contain true door computer fight deal pattern. Themselves police activity administration career bank decide. Live while compare move.,2024-09-06
810,267,384,2,Contain assume either remember event want may. Choice box place find bring.,2024-09-09
811,70,167,2,Voice line lawyer court total contain. Agency believe tend.,2024-08-26
812,104,691,1,Particular various party property light exist special. Act ten create play grow dream ten. Effect health item soon Democrat program might hospital.,2024-10-23
813,372,244,5,Wife hotel wide mission buy force itself cover. Investment recently some financial position treat bring plant.,2024-11-14
814,261,559,5,Society fly news hotel military. Ok customer society full begin understand natural require.,2024-06-03
815,449,385,5,Opportunity some against save establish. Let challenge pass laugh memory per catch. Seat available a agency teacher expect heavy.,2024-06-05
816,287,341,1,Market my west door body with modern.,2024-07-10
817,357,783,2,Establish guy treatment hospital. Possible realize whose book. Anyone collection rather pressure for piece vote.,2024-11-05
818,354,702,5,Rule trip practice both. Office find institution could no seek.,2024-04-27
819,266,679,5,Education just information or and level ago. Perform appear sometimes visit traditional level. Outside door dinner short.,2024-08-26
820,56,8,1,Same try throughout policy total describe. Involve nothing require occur general. Conference open site coach listen cost.,2024-11-27
821,381,60,3,Action son increase around will. Specific agree east total inside. Season ok relate.,2024-08-16
822,103,808,5,Might serve especially student organization charge. Whose discuss effect threat high five. National above computer address partner instead.,2024-04-15
823,465,574,5,Attention risk together health threat. Not card provide list camera democratic. Walk business successful nation drive.,2024-07-19
824,15,254,1,Drop future hotel. Special mention local direction others him participant country. Here site discover camera hot.,2024-07-22
825,91,677,3,Performance exactly bit build charge. Full company foot figure. Technology situation conference item.,2024-08-03
826,368,39,3,Painting blue modern money go. Along hot particular painting. Particular personal house area magazine.,2023-12-02
827,15,626,3,Should Democrat shoulder according better main Congress. To card lay authority dream.,2024-11-27
828,201,922,5,Wonder opportunity relationship news activity control. Clear able main quickly. Bar party themselves trial serious final voice.,2024-06-21
829,473,352,2,Major act above peace according feeling. Nature test audience on more responsibility style.,2024-03-27
830,412,44,2,Recently word enough he southern usually.,2024-08-13
831,271,868,1,Animal leg do. Deal laugh north meet dinner standard.,2024-11-12
832,358,537,4,Industry case these indeed. Assume life four new behavior far can. Detail sport trade program firm.,2024-10-15
833,293,627,4,Provide yard feeling speak support. Fill how trouble want lose nothing well.,2024-11-19
834,141,455,2,Great author level decade goal southern. Later suggest lead strong work training next media. Beyond mention individual throw pay.,2024-07-28
835,372,734,2,Itself detail feeling see organization. Special continue capital day first building. Music tree budget stand use. Plan drug move value whether risk dinner.,2024-04-13
836,179,795,2,Issue rate process eye career society receive. Season parent maintain sound.,2024-06-06
837,214,21,1,Let cost truth truth. Them economic according size.,2024-10-21
838,27,82,5,Stuff school agent world recognize. Can book training after party everybody. Open blue position chair part office born.,2024-08-01
839,296,473,2,Spend effect explain month. Attorney tough sister. With bad start adult partner.,2024-09-03
840,282,245,5,Money beautiful positive education baby development. Over such else discussion. Thus military choice choose.,2024-11-17
841,486,577,4,Drug through long while significant investment. Student bit order seat occur. Fish while kitchen thus with tax. Accept little career edge act.,2024-09-06
842,221,779,1,Seem American those close western statement product. Issue especially their.,2024-08-26
843,332,189,4,Institution watch man machine material religious sense. Official worry data himself. Itself else employee cultural all say.,2024-11-01
844,154,929,5,Despite night effect. Draw once catch. Difference finally history white hard interesting age. Her number near.,2024-11-09
845,138,527,1,Affect hospital image want find. At leg magazine officer reason work. World moment dark. Official probably treatment environment father.,2024-11-29
846,98,783,3,Financial population commercial peace middle the after.,2024-09-30
847,151,513,4,Range environmental yard act about yeah item yeah. Usually listen anyone voice rich store tough. Heavy feeling wind check want statement old store.,2024-11-16
848,345,679,2,Reason it main special. Doctor fall than floor it thought table list. Source program right firm. Almost read leader experience attention lead.,2024-10-04
849,361,861,3,Along section fill. Growth conference world make live now must.,2024-11-18
850,407,579,3,Chair above raise collection.,2024-11-24
851,144,852,1,Kind mission official. Research long right set something production. Health around relate skill.,2024-11-17
852,272,292,1,Director concern certainly drug career this bed. Experience hotel where remember minute western. Art toward off piece.,2024-11-18
853,197,4,1,Decade need pressure possible. Rest bad might.,2024-09-09
854,338,776,1,Receive low just go culture card. Product option fact fact recently. Environmental likely day operation.,2024-10-23
855,129,278,1,Business section always miss. Magazine action use create. Join eye tell local. Drop beat most where send.,2024-07-25
856,422,165,1,Window health article benefit husband end. Part catch offer bring base impact. Memory because pressure agree glass.,2024-08-15
857,295,263,1,Though crime with develop follow. Page guess our Congress shoulder work seek foot. Administration player remember whether sure able. System summer nothing speak.,2024-11-12
858,52,903,3,Knowledge thus traditional. Home southern view. Reflect piece above career.,2024-10-16
859,246,382,2,Great fight current management treatment. Debate involve suffer human so hope.,2024-09-01
860,132,463,5,Ball house whole close. On him cost well dinner per.,2024-10-13
861,453,205,1,Real Mr enjoy occur rich. Others open recently.,2024-11-19
862,17,989,1,Couple term about weight good air least physical. View most back serious. Customer teacher offer produce gun produce.,2024-11-29
863,75,826,2,Personal choice research color direction. Down character every page across bag. Respond radio which apply.,2024-11-29
864,478,297,4,Tv business personal land lead operation deep. Environmental remember present read.,2024-05-08
865,238,465,1,Turn item should peace none in action. Report help return cover.,2024-11-28
866,295,172,4,Find idea why so school peace.,2024-11-18
867,93,774,5,Condition music today through choice guy state. House without whom assume possible consider.,2024-10-27
868,291,572,3,Learn continue dream past against hour affect would. I available green answer Republican every arrive woman.,2024-08-09
