review_id,product_id,customer_id,rating,review_text,review_date
437,259,990,1,Such interview station bill almost owner. Free baby road so remember. Cause trip himself sea draw.,2024-11-21
438,239,806,4,Thousand loss reason popular get. Want specific cultural standard wish learn whole.,2024-11-16
439,201,257,2,Traditional stand turn method bar. Section theory degree indeed sometimes. Huge job mention watch. Difference all machine let charge thought.,2024-11-19
440,270,4,2,Nation most idea outside know allow. Skin pass nation accept notice. New call writer decade word quality.,2024-10-13
441,85,212,2,Investment Democrat word center capital station training. Century few admit else. Well center thus guy state.,2024-10-12
442,165,370,5,Inside road identify place character work magazine. Few by must doctor pay. Use third recently note eat beyond painting.,2024-05-06
443,161,415,2,Water action weight stay hotel ten. Little sea generation picture bill step interest. Boy exactly what something heart politics.,2024-07-02
444,149,577,4,Lay international size nor try happen quality police. Consumer west list. Recognize improve window everyone resource consumer research.,2024-11-15
445,339,65,1,During far laugh next commercial answer. Make hit east understand tell. Back machine push common send we information.,2024-09-04
446,336,67,5,Citizen pretty player wonder special stay. Her manager occur cover.,2024-10-13
447,157,496,3,Return any although course.,2023-05-03
448,103,670,5,North adult agreement begin treat style think. Early myself artist now. Have act soon street magazine newspaper.,2024-11-22
449,437,187,2,Audience move expect second approach. Last room even whose cell partner. Professor wish require.,2024-03-16
450,84,82,4,Girl car husband thank economic live. Lot evening size ask field.,2024-10-14
451,471,532,5,Never just soon more something. According morning even.,2024-11-16
452,409,549,2,Pm day future little drive deal. Control thought story watch.,2024-06-17
453,285,400,1,Another hotel accept management include can. Picture allow east.,2024-09-21
454,384,881,4,Still analysis bed strong poor itself. Research add to popular against from option. School on everything woman without.,2024-08-04
455,425,317,2,Attack practice be pay cost nice participant no. Indicate common war from. Knowledge fight sing people end general. Miss well although.,2024-07-17
456,218,81,5,Indeed enter old because sense.,2024-08-22
457,79,989,4,Design early today culture help factor soldier. Move environmental detail concern. Election environment hear member if one.,2024-10-25
458,7,329,2,So then player improve. Foreign value body include. Prepare adult main still edge.,2024-11-07
459,257,126,5,Within ahead administration safe my woman cause keep. Hotel choice pattern return. Enter nearly throughout just.,2024-10-13
460,132,224,3,Yard major participant. Allow site adult purpose affect success. Seat per truth senior instead someone knowledge.,2024-11-13
461,357,931,3,Production bank game attorney financial in. Include old ask suffer at society. Maybe picture company trade.,2024-07-23
462,173,107,2,Spend TV production material. Only miss though decision whether available.,2024-06-03
463,405,12,4,Political entire heavy. Rate which stand seat power usually. West case behavior big buy care wife.,2024-10-11
464,499,89,5,Miss very me attack your what.,2024-11-29
465,410,129,4,Heart talk recent before. Wrong feeling effort agree mention. Civil front thus campaign whatever product name. Clear coach past business assume various.,2024-11-19
466,103,886,5,Gun work low through. Picture that across the rule rather should.,2024-03-31
467,329,655,3,Back technology usually admit produce. Stay old the finally serious cold. Everybody success baby candidate our serve decade.,2024-11-21
468,207,206,3,Establish baby just occur bag white month. Strategy condition describe theory once appear. Mouth there article sing.,2024-11-27
469,99,140,2,Seek challenge even bag. Common meeting after simply must alone.,2024-11-22
470,275,189,5,Trip bit off third. Population result lawyer change me store per adult.,2024-08-29
471,34,611,1,Professional international this do. Anyone change radio. Bar attention care leader fish push talk.,2024-11-07
472,167,80,4,There quickly recognize picture into. Music opportunity book everything. Present break have Congress.,2024-11-23
473,64,195,3,These put ever.,2024-02-02
474,92,558,5,Entire something necessary life pick imagine in by. Head already anyone store suggest church us.,2024-11-29
475,18,515,4,Necessary recognize I grow tonight list. Part world former close.,2024-11-29
476,229,451,1,Attorney discover industry finish less. With training process politics record practice possible.,2024-10-23
477,139,518,1,General operation research huge. General really building sign recently. Production another paper will.,2024-07-06
478,64,476,4,Technology money worker spring mission west behind range. A third traditional ago.,2024-06-22
479,458,342,5,Throw begin around rate. Subject oil memory part participant try.,2024-10-31
480,256,942,2,Focus for every hospital up. Individual common court staff quickly across test do. Letter thank wind general usually.,2024-04-30
481,382,624,3,Former reason stock report. Manager then difficult side money improve fact. However top strong while large.,2024-03-24
482,224,208,2,Three value yard term. Participant kitchen summer consumer five various event.,2024-05-05
483,357,931,5,Yourself glass people quickly. Dark participant many economic later act.,2024-11-11
484,220,931,2,Standard indicate technology executive officer commercial. Guess former since the. Style rich sport ever spend.,2024-07-04
485,389,567,5,Wish same toward. Carry thing second example.,2024-03-25
486,9,240,1,Wife year work blood. Stuff public occur break. Pull operation article nothing.,2024-11-27
487,110,101,2,Step stay employee plant best company. Dark fast have best accept resource though.,2024-05-31
488,246,933,2,Raise computer fast. Available increase television development. Return poor should leg central.,2024-10-02
489,328,749,1,Kid decade ability three chair various. Successful compare possible red wall low size.,2024-09-09
490,164,214,2,Practice wear hour concern matter easy hand. Usually course wonder message role cover. Be Democrat explain partner.,2024-10-03
491,271,389,2,Like floor soldier true fine difference. Clearly movie their health hit. Information control there within right.,2024-10-04
492,236,134,1,Wonder about military fall raise.,2024-11-07
493,338,627,1,Like explain since. Serve board local.,2024-10-20
494,215,577,4,Up try must effect ball value writer. Later black grow traditional management reduce letter.,2024-10-21
495,72,884,2,Surface step cost field. Subject simple style create commercial media. Politics represent voice southern.,2024-11-28
496,9,171,2,Very bag bit bank ago director inside bed. Region leader body keep what it will just. Herself husband majority serious.,2024-10-26
497,247,694,3,Community professional hair manage approach Democrat claim. Your catch available risk. Be great significant song.,2024-05-17
498,411,468,1,Such senior learn body investment data education note.,2024-09-19
499,22,856,5,Certain major increase begin language. Act feel give wonder both. Imagine call help.,2024-10-27
500,237,808,1,Actually establish peace surface structure lead big. Money teach part successful service travel.,2024-10-03
501,111,639,2,Win certainly group media. Responsibility nor none opportunity thought. Degree may town entire brother attack travel card.,2024-10-13
502,97,752,1,Onto at career. Look firm probably goal.,2024-05-03
503,297,776,1,With into phone level visit. Instead suffer film without. Produce side kind agree energy card.,2024-11-17
504,19,538,4,Magazine party environment executive. Authority score security center rise husband else. Research recent miss agreement firm economy wife.,2024-07-29
505,426,761,1,Husband hotel sing. Party team century field.,2024-07-21
506,372,766,3,That according option away employee minute. Never around investment full order seat.,2024-06-14
507,372,875,2,Political study radio chair commercial.,2024-11-27
508,437,804,4,Against young stuff family child continue. Act citizen nice today want two. Tax heart read daughter later.,2024-09-03
509,361,370,2,Response moment summer approach certain. Likely society amount. Help among against late figure head. Manager fish capital rise plan many.,2024-09-12
510,127,270,2,Sense prevent student have time law. Will else official personal tend occur benefit.,2024-09-22
511,333,422,1,Hour coach every through tax short hundred. Season bad yourself Republican such.,2024-10-01
512,45,906,3,Remain charge race win.,2023-07-31
513,363,531,3,Peace information care director everyone response second three. Wrong assume few quality amount particular water. Which power next billion imagine charge.,2024-11-21
514,2,638,4,Summer develop quite Mrs. Look worry color community meet investment.,2024-11-17
515,271,26,4,Final listen audience hit fast. Dinner owner effect music.,2024-08-24
516,97,52,5,Require minute sort discuss. Plant big contain all design base. Risk upon ask friend.,2024-09-03
517,99,917,3,Director friend pick rest explain clearly. Increase recent what and no force. Site true analysis term party remain. Nature somebody attention street resource player agreement.,2024-10-17
518,361,191,4,Sit there technology friend.,2024-10-06
519,169,831,2,Less until land thousand. Ask appear true carry miss.,2024-11-29
520,467,744,2,Room medical memory south television. Remain edge perhaps. Choose agree region body science maybe.,2024-09-11
521,233,975,2,Everybody behind dark certainly short blue. Cold back energy mouth.,2024-08-05
522,30,924,4,Mean compare fish environmental name sense. Region sea shoulder under language start various. Get south major statement get cause.,2024-03-01
523,262,926,3,These son perform allow use. Because behavior analysis strong whose concern rate.,2024-03-02
524,375,254,2,Before him food bill total account. Election play occur chance sometimes yet people. Understand single already really many such foreign understand.,2024-11-26
525,483,780,2,History yes could raise market final. Suggest region as example front member. People recognize yes rule often build.,2024-07-10
526,453,562,4,Only others significant. Group adult Democrat campaign. Share care reason run area best.,2024-10-13
527,198,191,4,Meeting speech draw. Summer class improve.,2024-11-04
528,141,935,3,Seat network never tax rule interesting family argue. Worker performance way. Like choose none.,2024-08-01
529,220,931,4,Compare show money goal. Such large voice election write society. Keep thing professional apply.,2024-09-20
530,329,112,1,Who American think dinner despite usually somebody. With each maintain make arrive decade tonight when. Nor teacher read contain human.,2024-11-27
531,31,899,3,Present trouble discussion work bag as hair green. So practice government any we. Deep dinner whether generation article.,2024-11-21
532,406,852,1,International beyond memory history the computer center. Several would east person already ok. Through choice technology authority.,2024-11-27
533,199,960,4,Happen region investment make. Remain soldier watch size. Garden bill reason teach.,2024-08-04
534,222,62,4,Second those information official manager like. Per hair discussion age drive support Mrs show.,2024-11-15
535,431,913,2,Four far cell act somebody. Her last fine letter return already. Effect choose happen decade simply attack.,2024-11-16
536,235,671,1,Child simply your feel. Scene must bad former.,2024-11-27
537,192,490,1,Catch research bill effort economy. Hair nothing the material.,2024-09-22
538,178,790,4,Act few back black purpose his part prove. Meet country capital mean experience court break.,2024-10-23
539,473,352,5,Town its southern teach. Today than south. Scene newspaper traditional.,2024-04-05
540,481,64,3,Safe among like away happen beautiful technology. While executive somebody artist fish reach economic. Window provide camera require.,2024-09-18
541,219,362,2,Why develop kind father final rather public them. Mean together fight interesting evidence.,2024-09-08
542,195,340,4,Consumer together character five road little. Simply citizen in kind herself. Eight service business grow expert pull care. Follow director wear.,2024-11-19
543,10,570,1,Matter world operation safe suddenly morning serve. Detail environmental learn usually. Seat officer size why free.,2024-07-13
544,485,311,3,Development area mouth debate. Tonight bit strong interview.,2024-08-26
545,110,490,2,Ground before so lay. Police challenge point over. Despite behind join use center.,2024-10-26
546,465,837,3,Yeah total exist. National produce Mrs away act eight factor ever.,2024-05-03
547,156,128,3,Arm usually important. Mind pretty fire decade easy work. Certainly then side very.,2024-09-03
548,123,106,2,Similar of environment quite issue. Receive top toward century guy mission. Gun level defense happy over impact product.,2024-08-29
549,478,134,4,Close paper hair decide can own practice. Chair worker thought future almost action. Significant actually near animal.,2023-11-18
550,95,824,1,Claim certainly camera fine fly pay think. Method free likely state upon day apply. Do how look really keep traditional.,2024-11-29
551,154,639,4,Stand kind stage view state new always impact. Remember offer office economy. Scientist stay because cover from money.,2024-06-17
552,459,75,5,Even to science very under detail any charge. Person put how final.,2024-08-23
553,274,94,1,Some key plant full run every may. Here serious accept oil moment. Trial security only cover after out expect.,2024-11-26
554,382,280,5,Story week great can friend remember over. Phone shake wall focus.,2024-10-21
555,230,922,4,Service court name.,2024-07-04
556,294,114,3,Whose little important product like. Listen west which economic third box popular. Significant picture decade culture term by station.,2024-11-26
557,485,883,3,Within difference pick against mean people minute. Hot save rather box yeah. According view always opportunity research let.,2024-10-08
558,135,571,2,Military purpose hope person ready author wind. One though every north. Young single land hospital space road science.,2024-10-25
559,358,482,4,Home baby together seat nature. Commercial lead over people. Interesting surface floor mention particular meeting detail.,2024-11-03
560,11,321,2,Lot family beyond western. Miss seven guy suggest. Down deal success purpose body.,2023-12-12
561,161,228,3,Another doctor cell star fill man arrive product. Budget particularly group beat appear.,2024-10-14
562,189,182,4,Chair outside play cup pass college. What training position. Table cultural radio.,2024-10-06
563,324,712,4,Something able why approach measure. Phone at politics skill challenge. Every room big piece good south particular movement.,2024-09-16
564,229,451,3,Country site bring instead. Step appear require.,2024-11-22
565,391,567,2,Drive put world factor again color. Glass year year south. Area learn include level major.,2024-07-28
566,66,973,4,Step view operation early. Every health case certainly safe.,2024-11-09
567,392,917,2,Quite might understand concern born ever civil. Guy it just again interest attack.,2024-10-19
568,99,322,4,Despite fine question ask cost trade. Prepare business enjoy attorney another year.,2024-07-05
569,156,795,2,Wear control agent of series realize. Effect buy best others sport. Easy let person design memory likely.,2024-08-05
570,161,819,1,Personal college save during. Window keep agency necessary star data.,2024-10-19
571,335,951,2,Really at art court remain may. Question building hear service.,2024-11-17
572,105,828,4,Next peace technology themselves measure. Daughter service identify themselves.,2024-02-08
573,224,460,4,Show senior attention reflect consider.,2024-08-11
574,186,105,2,But opportunity recognize above ready any. Rise since hope environment.,2024-11-08
575,89,837,5,Keep agent exist site bit sometimes return. Receive fight dog guy find. My key worry. Bar kind floor improve miss real education.,2024-06-14
576,130,842,5,Single onto discussion special vote. Foot mouth party ability.,2024-09-27
577,18,13,2,City dark cultural out issue affect executive career. Born treat certainly.,2024-11-12
578,468,969,1,Book attack miss pass know score reason. Expect local garden class.,2024-10-13
579,395,790,3,Wrong parent relate short they doctor art billion. Notice sing stuff bill much simply. Popular move also drop teach director. After use race great large defense house.,2024-10-10
580,174,1000,3,Remain fund near organization article worker. Under threat card product manage. Whether reveal happy little theory speak church though.,2024-11-24
581,158,919,5,Increase nature modern sing appear. It determine tree sell early name all. Light including receive clear size especially present.,2024-11-29
582,178,790,3,Have place whose blue. Rise source cover history condition win important.,2024-08-11
583,151,733,1,Else threat lawyer activity. Ok shake investment employee add ask certain. Choice through card put purpose hair reality know.,2024-11-12
584,424,58,3,Three message book study student already. Information fly first view any professional. Lot rest current.,2024-08-13
585,154,860,5,Learn though last act president guess response. Goal president compare cold next.,2024-11-08
586,425,650,3,East character operation best. Artist however main wait ready well nation. Special special myself once region upon gas.,2024-06-15
587,70,804,4,Physical wait material real card. Expect speak serious enjoy artist happy there.,2024-07-31
588,328,65,1,Than save then note specific.,2024-07-09
589,242,87,1,Candidate science force note forget. Increase cell subject fight ago hair teacher rock. Want need past doctor whom.,2024-11-13
590,67,469,5,Main protect discover seat arrive strategy near. Pick speak various own fund security attack west. Activity war free glass improve ever feeling.,2024-05-09
591,148,807,1,Appear indeed hot leg everyone. Long family cell tree and even property. Board cell factor picture kitchen Democrat player lay.,2024-10-08
592,163,251,2,Third member upon sister six box style. Wrong involve action establish board. Say organization life skill. Often suddenly language between mean rule maintain.,2024-11-27
593,354,450,3,Coach tend trade happen minute author. Across chance card bring station medical interview.,2024-09-03
594,289,230,3,If tend thing address some bag send. Worker many shoulder become in future.,2024-08-11
595,166,408,2,Recently decade hope whole within available. Will glass role.,2024-10-07
596,378,828,5,Develop market experience consumer statement stay.,2024-07-04
597,103,670,5,At anyone rise on smile discussion government.,2024-11-24
598,453,562,5,Operation ago light property hold. Table stuff suffer rule past.,2024-08-02
599,427,373,5,Order back that successful president too lose. Control cause doctor talk red room. Current seven month instead various life.,2024-09-27
600,223,711,2,Cover worker strong fund. Skill medical ahead grow. Popular fly could law poor.,2024-10-01
601,493,388,4,Concern seek various themselves thing. Full peace house finally energy age forget once. Painting field bar game class represent perform.,2024-10-31
602,305,2,5,Figure go visit image shake door conference.,2024-06-25
603,114,671,1,Interest see so.,2024-11-29
604,196,646,2,Choose field street politics civil. Let stay energy miss wonder.,2024-10-26
605,418,172,1,Any away idea case from night. Cell apply against fish score. Quite thought follow assume notice civil paper.,2024-10-04
606,210,614,3,Detail after open school unit. Nor job game. Degree grow box reduce who like minute.,2024-06-08
607,493,388,5,Minute organization lead. Manager court news company edge admit enter.,2024-11-21
608,226,630,4,Across language article letter give later girl determine. You this source suddenly. But leader into find add wrong scene.,2024-11-22
609,117,564,5,Ago decision again tell. Reduce leave arm film.,2024-08-16
610,160,761,3,Forward them eye also music may this culture. Class true of agree television new admit. Newspaper only imagine require expect.,2024-10-07
611,97,52,1,Material system figure catch between share discover. Throw word thing main sure.,2024-06-27
612,46,455,4,Campaign during believe short list trip. Smile parent green foot. Government down success director all travel reason. Author society spring young likely.,2024-05-30
613,97,429,2,Camera machine car sign control. Very but certain question.,2024-07-08
614,236,460,2,Choose spring really moment wind.,2024-06-17
615,475,974,1,Question yet say air. Catch interest set air student expert. Special history on.,2024-11-21
616,51,56,3,Reach left could cause near court policy. Day idea far break national Republican their. Civil college rest wait spend environment receive.,2024-11-23
617,151,513,4,Keep scientist western cost. Never apply well movement owner. Ok bar approach these. Travel federal forget capital.,2024-11-01
618,386,562,3,Many act agency upon true. Same despite hit civil. Expert bad hot page make present.,2024-08-20
619,173,347,3,Do return prove week produce whose pretty old. It force away month others. Operation develop over away.,2024-07-18
620,115,298,5,Whether even heart machine else might. Thing time beat. Best staff low over training someone show.,2024-06-09
621,153,865,2,Central have doctor low however. Agency former know character understand.,2024-10-18
622,386,980,4,History image travel drug. Response son similar community reflect big minute. Hard own up degree.,2024-04-27
623,168,677,5,Example card data factor arm strategy television. Central sense once choose develop. Effort night according born adult.,2024-11-07
624,108,761,5,Pretty western morning hope audience different. Make then necessary write first sense identify.,2024-09-13
625,453,645,5,Crime full read travel story age bit.,2024-10-27
626,391,293,3,You food also into live card.,2024-10-13
627,281,29,1,Race so animal actually land group. Of whatever sense give ball deal direction.,2024-10-14
628,340,560,4,Visit kind scientist section discussion relationship notice. Pull land top into consider west.,2024-10-07
629,364,172,4,Management similar loss return wide education education give. How wall politics. Give be walk visit.,2024-11-10
630,56,804,5,Produce investment wife soon concern team. Protect buy couple century race action religious.,2024-08-14
631,254,809,2,Try despite current door fund role character. Night which well push history suffer than. Trial direction sea alone ready.,2024-11-21
632,475,166,2,Wind finish feel audience administration too available. Agency management main themselves name company dog use. Until less business free mother.,2024-11-22
633,106,551,3,Should medical field about book stock ground. Before enough project long. Loss her skin pass home young. Government during current dinner but.,2024-06-29
634,406,852,1,Just agent cover always kitchen. Population east official enough establish. Bed lose several look strategy. Need compare send arm participant range former.,2024-11-13
635,259,824,3,A peace law store. Fine section material responsibility action listen.,2024-11-29
636,78,782,3,Analysis why yes skin million worker learn. Ever until they hot much. Along across customer billion.,2024-11-14
637,1,517,4,Ten large news and. Impact also mouth cover newspaper process. Beat where cell name specific.,2024-11-02
638,289,701,2,Just home ahead growth often. Collection rule side cup follow.,2024-09-16
639,218,765,5,Cultural paper couple heart recognize both. Bar tough never doctor name old. Leg here should population.,2024-05-28
640,244,423,3,Reveal notice though lawyer dark read rock. Gun move space room military school our wrong. Give budget herself to worry policy.,2024-11-18
641,269,856,4,Need stand see yourself TV miss by. Until power measure son catch seat. Type buy above chair this hand.,2024-11-26
642,439,195,2,Stuff follow live need again mouth get heavy. Risk language well professor. Conference how step job reason along certainly.,2024-11-16
643,111,639,4,Themselves likely president cold. Will behind weight much watch participant. Treatment reflect skin possible participant right. Catch create make two hundred.,2024-04-06
644,414,707,5,Bank none run. Budget bed color suddenly center.,2024-09-19
645,441,527,1,Box drug attack far. Believe order development natural campaign late difference evidence.,2024-11-18
646,479,36,1,Much each fact one economic cause. Cause charge road wrong score within. Standard opportunity than large capital history. Decision unit person company month.,2024-08-16
647,372,734,1,Station politics area simple.,2023-11-12
648,80,425,5,Source worker sister crime experience leader early tell.,2024-08-18
649,161,819,2,Doctor design natural nature. Gas place property together upon.,2024-07-11
650,336,13,2,Citizen significant race night keep girl. Lead away center term service late.,2024-05-26
651,217,575,4,This bit finally. Fine trial page reflect forget sure. Official friend difference win country. Spend interest always party.,2024-11-28
652,186,947,1,Audience final skill partner player federal over. East system appear arm.,2024-04-14
653,417,582,2,Attack theory data impact scene high son himself. Ask born treat success line young. Conference field although its national response many.,2024-11-05
654,68,100,4,Nature hope organization main area. Decade rock positive by Mr yet. Party third board TV painting care theory.,2024-05-16
